{
  "schema_version": 1,
  "id": "ssh",
  "name": "OpenSSH client",
  "revision": 1,
  "summary": "Foreground service guidance for OpenSSH client, with reviewed descriptor suggestions.",
  "match": {"executable_basenames": ["ssh"], "case_sensitive": true},
  "compatibility": {"systemd_min": 249, "application_version": null, "version_policy": "version-independent-advice"},
  "recommendations": [
    {"field": "nofile.soft", "value": 65536, "scope": ["system", "user"], "apply": "suggestion", "strength": "recommended", "risk": "resource-change", "reason": "Optional capacity policy: verify the installed implementation and workload before selecting this limit.", "source_ids": ["descriptor-policy"], "conditions": {"nofile_at_least": 65536}},
    {"field": "nofile.hard", "value": 65536, "scope": ["system", "user"], "apply": "suggestion", "strength": "recommended", "risk": "resource-change", "reason": "Optional capacity policy: verify the installed implementation and workload before selecting this limit.", "source_ids": ["descriptor-policy"], "conditions": {"nofile_at_least": 65536}}
  ],
  "advisories": [
    {"code": "foreground-workflow", "message": "For persistent forwarding use a foreground -N invocation without -f, with BatchMode=yes, ExitOnForwardFailure=yes and reviewed ServerAliveInterval/ServerAliveCountMax. Finite remote commands need --restart no."},
    {"code": "deployment-requirements", "message": "Use the intended account and verified host keys. Agent sockets may not survive logout or reboot. Arbitrary SSH builds, proxy commands and remote-command modes do not justify automatic high descriptor limits."},
    {"code": "descriptor-capacity", "message": "The 65536 descriptor pair is a suggestion only. Accept it only after verifying the build supports high descriptors; otherwise retain inherited limits."},
    {"code": "restart-and-health", "message": "The existing on-failure restart policy and delay remain in effect unless explicitly changed. Finite commands need --restart no; long-running modes still need application health and capacity monitoring."},
    {"code": "profile-match-hint", "message": "Basename matching does not authenticate the executable, version or build. Preserve the original arguments, working directory and explicit user choices."}
  ],
  "sources": [
    {"id": "upstream-usage", "url": "https://man.openbsd.org/ssh.1", "checked_at": "2026-10-01", "source_kind": "upstream-documentation"},
    {"id": "descriptor-policy", "url": "https://raw.githubusercontent.com/systemd/systemd/v249/man/systemd.exec.xml", "checked_at": "2026-10-01", "source_kind": "tired-policy"}
  ]
}
